{
  "brief_hash": "02158a08",
  "iteration": "006",
  "summary": "초안은 네 겹의 사고 전환과 각 관측을 비교적 안정적으로 따라가며, 결론을 ‘테스트’가 아니라 ‘잣대의 소유’로 모으는 힘이 있다. 다만 채용 담당 독자에게는 중후반의 하네스 설명이 길고 추상적으로 누적되어, ‘이 사람이 팀에서 어떻게 판단하는가’보다 ‘시스템 구조 설명’으로 읽힐 위험이 있다.",
  "strengths": [
    "도입부가 2000줄 결제 코드 경험과 AI 코드 평가의 불안을 연결해, 문제의식이 개인 경험에서 출발한다는 점을 잘 보존한다.",
    "첫 겹부터 넷째 겹까지 각 전환에 관측이 붙어 있어, 결론만 주장하는 글이 아니라 사고가 바뀐 경로로 읽힌다.",
    "‘AI 신호는 판정석이 아니라 증인석’이라는 구분이 선명하고, 글 전체의 핵심인 잣대 소유 문제를 압축한다.",
    "성장의 정의, 대가, 어디까지 했고 못 했고 다음에 할 일까지 포함되어 필수 조건을 대부분 충족한다."
  ],
  "weaknesses": [
    {
      "issue": "중후반부가 하네스 내부 구조 설명으로 길게 기울어 독자 목적과의 연결이 약해진다.",
      "why_it_matters": "brief의 독자는 백엔드 개발자를 뽑는 사람이고, 원하는 것은 ‘남에게 그대로 옮길 수 있는 근거’다. 그런데 ‘판정 세 칸’, ‘느린 루프’, ‘채점표 개정 조건’이 이어지면서 독자는 이 사람의 판단력을 확인하기보다 시스템 설계 문서를 읽는 느낌을 받을 수 있다.",
      "suggestion": "각 큰 절 끝에 한 문장씩 ‘그래서 내가 이후 작업에서 무엇을 다르게 했는지’ 또는 ‘이 관측이 내 판단 습관을 어떻게 바꿨는지’를 붙이고, 하네스의 세부 동작은 성장 정의와 직접 연결되는 것만 남겨 밀도를 낮춰라.",
      "severity": "medium"
    },
    {
      "issue": "‘판정을 왼쪽으로 옮긴다’는 핵심 비유가 초안에서는 충분히 시각화되지 않는다.",
      "why_it_matters": "이 개념은 글의 네 번째 전환이자 자동화 방향을 설명하는 중요한 대목인데, 독자가 이미 저자의 세 칸 모델을 머릿속에 붙잡고 있어야 이해된다. 세 문장 이상으로 관계를 설명하는 대목이므로, 문장만 이어가면 추상도가 올라가고 기억에 남는 구조가 약해진다.",
      "suggestion": "‘사람 승인 → AI 신호 → 결정적 검사’처럼 잣대가 이동하는 방향을 짧은 아스키 다이어그램으로 한 번 보여주고, 필드명/시각표기 사례가 어느 칸에서 어느 칸으로 내려갔는지 표시해라.",
      "severity": "medium"
    },
    {
      "issue": "결말부가 좋은 문장을 많이 담고 있지만, 마지막 인상이 다소 분산된다.",
      "why_it_matters": "마지막에는 ‘이건 무엇으로 판정되나’와 ‘잣대를 안 쥐면 틀린 속도만 빨라진다’가 강한 문장인데, 공개 저장소, 판단 과정, 독자 질문까지 이어지며 여러 기능을 동시에 수행한다. 채용 독자는 마지막에 무엇을 가져가야 하는지 살짝 흐려질 수 있다.",
      "suggestion": "결말의 기능을 하나로 정해라. 독자에게 남길 질문을 살릴지, 성장 정의의 대가를 살릴지, 공개 저장소의 검증 가능성을 살릴지 우선순위를 정하고 나머지는 앞 절로 옮기거나 줄여라.",
      "severity": "low"
    }
  ],
  "revision_directions": [
    "전체를 ‘네 겹의 전환’ 중심으로 다시 압축하고, 각 겹마다 관측 → 바뀐 판단 → 이후 행동 변화의 순서를 반복해 독자가 패턴을 따라가게 만들어라.",
    "하네스 설명은 내부 구현보다 ‘판정권을 어디에 둘 것인가’에 필요한 요소만 남겨라. 특히 채점표, 루프, 세 칸 모델이 한꺼번에 나오는 구간은 독자의 부담이 크다.",
    "‘판정을 왼쪽으로 옮긴다’와 ‘AI는 증인석’처럼 추상 개념은 짧은 도식이나 비유로 받쳐라.",
    "마지막 문단은 한 가지 메시지로 조여라. 현재 후보 중 가장 강한 것은 ‘잘 짰어?’ 대신 ‘무엇으로 판정되나?’를 먼저 묻는 전환이다."
  ],
  "reader_risks": [
    "채용 담당 독자는 기술적 성실함은 느끼지만, 글 후반에서 ‘그래서 이 사람을 뽑을 근거가 무엇인가’를 다시 정리해야 할 수 있다.",
    "하네스, 루브릭, 느린 루프를 모르는 독자는 중간부터 구조를 따라가느라 저자의 사고 변화보다 장치 설명에 주의를 빼앗길 수 있다.",
    "결말의 메시지가 여러 개라, 독자가 글을 덮고 나서 ‘잣대 소유’보다 ‘테스트 자동화 이야기’로 기억할 가능성이 있다."
  ],
  "unsupported_claims": [],
  "suggestions": [
    {
      "kind": "angle",
      "target": "결과만 남으면 확인하는 사람은 다시 캐물어야 한다.",
      "proposal": "채용 독자 관점에서는 이 글을 ‘내가 잘했다’가 아니라 ‘내 판단 과정을 남이 검증할 수 있게 만든 기록’으로 더 선명하게 볼 수 있다. 이 관점을 조금 더 밀면 글의 독자 정렬이 강해진다.",
      "needs_author": false
    },
    {
      "kind": "counterpoint",
      "target": "재현되는 판정은 넘긴다. 재현되지 않는 판정은 신호로만 받는다. 그리고 잣대는 넘기지 않는다.",
      "proposal": "완전히 넘기지 않는 잣대도 시간이 지나면 낡을 수 있다. 사람이 잣대를 쥐는 것과, 그 잣대가 계속 유효한지 의심하는 절차는 별개의 문제라는 반대 논리를 한 번 열어둘 수 있다.",
      "needs_author": false
    },
    {
      "kind": "material",
      "target": "그래서 이 실험은 실패한 실행 로그, 기각된 산출물, 수정 전후 지시까지 공개 저장소에 남겼다.",
      "proposal": "brief에 재료가 있다면, 공개 저장소에서 독자가 실제로 확인할 수 있는 대표 항목 1개가 필요하다. 링크나 저장소명 자체가 아니라, 어떤 실패 기록을 보면 이 글의 판단 과정을 검증할 수 있는지에 대한 저자 확인 재료가 필요하다.",
      "needs_author": true
    }
  ],
  "critiqued_at": "2026-08-24T10:33:34+09:00",
  "model": "gpt-5.5",
  "metadata": {
    "prompt_version": "critique_system:v1",
    "source_files": [
      "02158a08_input.json",
      "02158a08_iter-006_draft.json"
    ],
    "token_usage": {
      "input_tokens": 53092,
      "cached_input_tokens": 21888,
      "output_tokens": 2020,
      "reasoning_output_tokens": 516
    }
  }
}
