{
  "brief_hash": "310164c7",
  "iteration": "002",
  "summary": "핵심 논지와 단계별 이동은 잘 살아 있고, 마지막에 ‘어디까지 했고 무엇을 못 했고 다음에 무엇을 할지’도 비교적 분명하다. 다만 중반부의 개념 밀도와 사례 배치가 높아 처음 읽는 독자가 사다리의 각 칸을 따라가기보다 내부 장치 설명으로 읽을 위험이 있다.",
  "strengths": [
    "각 단계마다 ‘넘어간 것’과 ‘남은 것’을 반복해서 짚어, 글의 중심 질문인 ‘나는 어디에 서 있어야 하는가’가 끝까지 유지된다.",
    "채점표가 결정적인 장치가 아니라 ‘결정적인 척하는 신호’라는 한계를 숨기지 않아, 과장 없는 개발자 회고의 톤이 좋다.",
    "환불 정책 실험, 날조된 1인칭 문장, 빈 판정란 아홉 편처럼 구체 사례와 숫자가 글의 신뢰를 받친다.",
    "결론부에서 성장의 정의, 그 대가, 다음 할 일을 분리해 독자가 가져갈 문장이 생긴다."
  ],
  "weaknesses": [
    {
      "issue": "중반의 ‘흔들리는 점수는 신호로만 썼다’ 절이 너무 많은 역할을 한 번에 맡고 있다.",
      "why_it_matters": "이 절은 세 칸 분류, 점수의 위험, 첫 채점표 실패, 5점 설명 수정, 흉내 층에서 기계 검사로 내려간 사례까지 담는다. 독자는 핵심인 ‘결정적인 것과 흉내인 것의 경계’를 이해하기 전에 사례가 누적되어 피로해질 수 있다.",
      "suggestion": "이 절의 중심 사례를 하나로 고르고, 나머지는 다음 절로 보내거나 짧은 연결 문장으로 낮추세요. 세 칸의 관계는 현재 표와 함께 `기계 검사 / AI 점수 / 사람 승인`이 각각 무엇을 넘기고 무엇을 남기는지 한 줄씩 붙여 독자가 표를 해석하지 않아도 따라오게 하세요.",
      "severity": "medium"
    },
    {
      "issue": "‘빠른 반복’, ‘느린 반복’, ‘한 칸 더 올라가는 길’의 관계가 문장으로만 이어져 구조가 늦게 잡힌다.",
      "why_it_matters": "이 글의 핵심은 단계가 위로 올라가며 무엇을 AI에게 넘기고 무엇을 사람이 쥐는지 보는 것이다. 그런데 빠른 반복, 느린 반복, 자기 채점표 수정 금지의 관계가 세 문단 이상 이어져 처음 읽는 독자는 어느 루프가 무엇을 고치는지 헷갈릴 수 있다.",
      "suggestion": "‘고칠 곳을 제안하게 했지만 바꿀지는 남겼다’ 또는 다음 절 앞에 짧은 아스키 다이어그램을 넣어 `산출물 생성 -> 검사 -> 고쳐쓰기`와 `실행 기록 -> 개선 제안 -> 사람 승인`을 위아래로 분리해 보여주세요.",
      "severity": "medium"
    },
    {
      "issue": "몇몇 소제목과 용어가 brief의 요구보다 내부 장치 중심으로 기울어 있다.",
      "why_it_matters": "요구 조건은 소제목을 ‘그 절에서 무슨 일이 있었는지’로 쓰고, 글 안에서 따로 배워야 하는 말을 피하라는 쪽이다. ‘자기 채점표까지 고치게 두지는 않았다’, ‘흔들리는 점수는 신호로만 썼다’는 의미는 정확하지만 처음 독자에게는 사건보다 장치 이름이 먼저 보인다.",
      "suggestion": "소제목을 사건형으로 바꾸는 방향을 검토하세요. 예를 들어 ‘점수가 같은 글도 다르게 보았다’, ‘고치는 방법을 고치게 하지는 않았다’처럼 독자가 장치명을 몰라도 무슨 일이 있었는지 먼저 보이게 하세요.",
      "severity": "low"
    }
  ],
  "revision_directions": [
    "각 절마다 ‘이번 칸에서 넘어간 것 / 그래서 남은 것’을 한 번씩 명시적으로 점검해, 반복 구조를 더 선명하게 유지하세요.",
    "중반부의 표와 도식은 살리되, 빠른 반복과 느린 반복의 차이도 별도 작은 도식으로 보여주세요.",
    "‘하네스’, ‘산출물’, ‘대조’, ‘느린 반복’처럼 처음 읽는 독자가 멈출 수 있는 말은 처음 나오는 자리에서 쉬운 문장으로 풀어주세요.",
    "소제목을 내부 개념보다 사건 중심으로 다듬어, 목차만 읽어도 실험의 순서가 보이게 하세요."
  ],
  "reader_risks": [
    "일의 일부를 AI에게 넘기기 시작한 독자는 환불 정책 실험까지는 쉽게 따라오지만, 세 칸 표 이후부터는 ‘그래서 지금 무엇이 넘어갔다는 말인가’를 놓칠 수 있다.",
    "개발 배경이 약한 독자는 ‘채점표’, ‘대조’, ‘산출물’, ‘하네스’가 비슷한 내부 장치처럼 보여 감정적 결론보다 시스템 설명으로 받아들일 수 있다.",
    "결론의 ‘성장’ 정의는 좋지만, 앞부분의 장치 설명이 길게 느껴지면 그 정의에 도착하기 전에 글의 개인적 긴장이 약하다고 느낄 수 있다."
  ],
  "unsupported_claims": [],
  "suggestions": [
    {
      "kind": "angle",
      "target": "성장을 다시 정의하게 됐다. 더 오래 붙잡고 있는 사람이 되는 것이 아니라, 어떤 일은 완전히 넘길 수 있는지, 어떤 일은 흉내로만 넘겨야 하는지, 어떤 일은 아직 사람이 소유해야 하는지 계속 다시 가르는 사람이 되는 것이다.",
      "proposal": "같은 재료로 ‘성장은 생산 능력의 증가가 아니라 판단을 이전할 수 있는 단위로 일을 다시 자르는 능력’이라는 관점도 가능하다.",
      "needs_author": false
    },
    {
      "kind": "counterpoint",
      "target": "AI에게 넘길 수 있는 것은 생각보다 많았고, 그래서 남는 자리는 더 흐릿해지지 않았다.",
      "proposal": "반대로, 넘길수록 사람이 남는 자리는 더 자주 바뀌기 때문에 ‘정확해졌다’기보다 ‘계속 갱신해야 하는 자리라는 사실이 분명해졌다’고 볼 수도 있다.",
      "needs_author": false
    },
    {
      "kind": "material",
      "target": "이번에는 먼저 그 스토리보드를 구체화하는 작업자를 만들었다. 그 응답을 토대로 인터뷰어와 인터뷰이를 만들어, 내가 수동으로 하던 인터뷰를 자동화했다.",
      "proposal": "brief에 재료가 있다면, 이 자동화 전후에 사람이 직접 하던 인터뷰에서 무엇이 줄었고 무엇은 여전히 사람이 승인했는지 보여주는 짧은 실제 예가 필요하다.",
      "needs_author": true
    }
  ],
  "critiqued_at": "2026-08-24T15:27:52+09:00",
  "model": "gpt-5.5",
  "metadata": {
    "prompt_version": "critique_system:v1",
    "source_files": [
      "310164c7_input.json",
      "310164c7_iter-002_draft.json"
    ],
    "token_usage": {
      "input_tokens": 34626,
      "cached_input_tokens": 21888,
      "output_tokens": 2015,
      "reasoning_output_tokens": 516
    }
  }
}
