{
  "brief_hash": "16922d4b",
  "iteration": "002",
  "summary": "초안은 네 겹의 사고 전환과 관측을 비교적 충실하게 압축했고, 결론도 brief의 중심인 '잣대의 소유'로 모인다. 다만 원본의 많은 구조를 거의 그대로 가져오면서 목표 분량과 채용 독자 관점에서는 밀도가 높고, 몇몇 핵심 관계는 설명이 길어지는데도 그림 없이 지나가 독자가 따라가야 할 부담이 남는다.",
  "strengths": [
    "도입의 2000줄 결제 코드 경험과 AI 평가 흔들림이 잘 연결되어, 문제의식이 개인 경험에서 출발한다는 점이 살아 있다.",
    "각 사고 전환마다 관측 수치나 사례가 붙어 있어 '결론만 말하는 회고'로 흐르지 않는다.",
    "AI의 출력도 판정석이 아니라 증인석으로 쓴다는 구분은 글의 독자에게 실무적 판단 기준으로 남기 좋다.",
    "성장의 정의, 대가, 어디까지 했고 무엇을 못 했고 다음에 할 일이 모두 포함되어 필수 조건을 대체로 충족한다."
  ],
  "weaknesses": [
    {
      "issue": "전체가 원본의 큰 구조를 거의 다 보존해 목표 독자에게 필요한 핵심보다 과정의 양이 앞선다.",
      "why_it_matters": "brief의 독자는 백엔드 개발자를 뽑는 사람이고, 원하는 것은 '이 사람이 남에게 옮길 수 있는 근거를 남기는 사람인가'에 대한 판단 재료다. 현재 초안은 실험과 장치 설명이 풍부하지만, 채용 독자가 기억해야 할 판단 변화 네 개가 후반으로 갈수록 정보량에 묻힌다.",
      "suggestion": "각 장의 끝에 '이 관측 때문에 내가 버린 판단 / 새로 잡은 판단'을 한 문장으로 고정하고, slow loop·기계가 이긴 곳·닫지 않은 질문은 핵심 판단을 받치는 사례만 남기도록 압축하라.",
      "severity": "high"
    },
    {
      "issue": "판정의 세 칸과 '왼쪽으로 옮긴다'는 관계가 독자에게 혼동될 수 있다.",
      "why_it_matters": "초안은 '사람 판단 -> AI 점수 -> 문자열 검사'라고 쓴 뒤 '오른쪽에 있던 것 하나가 왼쪽으로 내려간 것'이라고 말한다. 원문의 논리는 재현성이 낮은 판정을 결정적 검사 쪽으로 옮긴다는 뜻인데, 현재 방향 표기가 그 의미와 어긋나 보인다.",
      "suggestion": "세 칸을 재현성 낮음에서 높음, 또는 사람 소유에서 기계 판정으로 한 방향으로 다시 놓고, `사람 판단 -> 흔들리는 점수 -> 결정적 검사` 같은 아스키 다이어그램에 화살표 의미를 붙여라.",
      "severity": "high"
    },
    {
      "issue": "하네스, 게이트, 루브릭, slow loop가 한꺼번에 등장해 비경험 독자에게는 장치의 실제 모습이 흐릴 수 있다.",
      "why_it_matters": "개념을 아는 개발자는 따라오지만, 채용 독자는 '그래서 이 사람이 실제로 어떤 검증 구조를 만들었나'를 빠르게 잡아야 한다. 지금은 절차가 문장으로 이어져 있어 읽는 사람이 머릿속에서 구조도를 직접 그려야 한다.",
      "suggestion": "하네스 설명 구간에 `입력 -> 생성 -> 비평 -> 채점 -> 수정 -> 계약 검사`처럼 한 줄짜리 흐름도를 넣고, 루브릭은 '점수표', 게이트는 '통과 조건'처럼 처음 한 번만 더 쉬운 말로 붙여라.",
      "severity": "medium"
    },
    {
      "issue": "마지막 결론이 강하지만 채용 독자에게 직접 남는 증거 문장으로 수렴하는 힘은 약하다.",
      "why_it_matters": "brief의 독자는 '확인은 쓴 사람이 할 일이지 읽는 사람이 캐낼 일이 아니다'라는 관점에서 글을 읽는다. 초안은 기술적 회고로는 단단하지만, '내 판단 과정을 남에게 검증 가능하게 남기는 사람'이라는 지원자 신호를 끝에서 충분히 명시하지 않는다.",
      "suggestion": "결말 직전에 이 3주가 '내가 잘했다'가 아니라 '내 판단이 틀릴 수 있는 자리를 밖에 만들었다'는 증거라는 식으로 독자 이익을 한 번 더 연결하라.",
      "severity": "medium"
    }
  ],
  "revision_directions": [
    "목표 분량 5500-7000자에 맞게 slow loop, 사람에게 남는 세 자리, 기계가 이긴 곳을 압축하고 네 겹의 사고 전환을 중심축으로 남겨라.",
    "각 겹마다 관측 -> 버린 판단 -> 새 판단의 순서가 한눈에 보이도록 마지막 문장을 정리하라.",
    "'판정을 왼쪽으로 옮긴다'의 방향을 일관된 다이어그램으로 고쳐 독자가 위치 관계를 헷갈리지 않게 하라.",
    "하네스 설명은 절차를 나열하기보다 입력과 출력, 누가 무엇을 못 보게 했는지를 한 번에 보여주는 구조로 바꿔라.",
    "마지막에는 채용 독자가 가져갈 판단 근거, 즉 '이 사람은 자신의 판단 기준을 외부화하고 실패 기록까지 남기는 사람'이라는 신호가 드러나게 마무리하라."
  ],
  "reader_risks": [
    "중반 이후 실험 수치와 장치 설명이 많아져, 독자가 '좋은 말은 알겠는데 그래서 이 사람의 핵심 변화가 뭐였지'라고 되물을 수 있다.",
    "'왼쪽으로 옮긴다'의 방향이 헷갈리면 글의 핵심 은유가 오히려 독해를 방해할 수 있다.",
    "하네스와 루브릭을 실제로 써본 적 없는 독자는 slow loop 대목에서 추상적인 자동화 설계 이야기로 느낄 수 있다.",
    "채용 담당 독자는 기술적 엄밀함은 느끼지만, 팀에서 함께 일할 때 어떤 행동으로 나타날지까지는 스스로 연결해야 할 수 있다."
  ],
  "unsupported_claims": [],
  "suggestions": [
    {
      "kind": "angle",
      "target": "마지막에 남은 것은 테스트가 아니라 잣대를 누가 쥐느냐였다.",
      "proposal": "이 글은 'AI를 어디까지 믿을까'보다 '내 판단을 남이 재실행할 수 있는 형태로 남겼는가'라는 채용 관점의 글로도 읽힐 수 있다.",
      "needs_author": false
    },
    {
      "kind": "counterpoint",
      "target": "재현되는 판정은 넘길 수 있다. 재현되지 않는 판정은 신호로만 받을 수 있다. 그리고 잣대는 넘기지 않는다.",
      "proposal": "재현되는 판정도 그 판정이 실제 위험을 대표한다는 전제가 있어야 넘길 수 있다. 재현성은 필요조건이지 충분조건은 아니다.",
      "needs_author": false
    },
    {
      "kind": "extension",
      "target": "성장이란, 내가 틀렸다는 사실이 나 없이도 드러나는 자리를 하나 더 만드는 것이다.",
      "proposal": "이 정의를 더 밀면, 성장의 증거는 더 많은 정답이 아니라 더 잘 보존된 실패 기록과 반례 목록이 된다.",
      "needs_author": false
    },
    {
      "kind": "material",
      "target": "실험 기록은 실패한 것까지 공개 저장소에 남겼다.",
      "proposal": "brief에 재료가 있다면, 공개 저장소에서 독자가 실제로 확인할 수 있는 기록의 종류나 위치를 한 문장 수준으로 특정할 재료가 필요하다.",
      "needs_author": true
    }
  ],
  "critiqued_at": "2026-08-24T10:00:23+09:00",
  "model": "gpt-5.5",
  "metadata": {
    "prompt_version": "critique_system:v1",
    "source_files": [
      "16922d4b_input.json",
      "16922d4b_iter-002_draft.json"
    ],
    "token_usage": {
      "input_tokens": 51817,
      "cached_input_tokens": 2432,
      "output_tokens": 2196,
      "reasoning_output_tokens": 516
    }
  }
}
