{
  "brief_hash": "d264193d",
  "iteration": "002",
  "summary": "초안은 원문의 큰 논리 흐름을 잘 압축했고, 네 겹의 사고 전환과 관측을 대부분 보존한다. 다만 판정의 세 칸을 설명하는 방향이 뒤집히면서 핵심 은유가 흔들리고, 채용 독자에게 왜 이 글이 ‘판단 가능한 지원자’의 근거가 되는지 연결이 약하다.",
  "strengths": [
    "도입의 문제 설정이 선명하다. 2000줄 결제 코드 경험과 AI 평가의 흔들림이 같은 구멍으로 이어져 글의 출발점이 납득된다.",
    "각 겹마다 관측 수치가 붙어 있어 ‘생각이 바뀌었다’가 선언으로만 남지 않는다. 16/18, 2건 누락, 277줄 대 132줄, 4점과 2.5점 같은 재료가 힘을 만든다.",
    "‘판정석이 아니라 증인석’, ‘초록불은 협상 대상이 된다’ 같은 문장이 추상 논지를 독자가 붙잡을 수 있는 형태로 만든다.",
    "마지막 회고에서 성장의 정의, 대가, 못 한 일, 다음 작업이 분리되어 있어 개발자 회고로서 책임 범위가 비교적 분명하다."
  ],
  "weaknesses": [
    {
      "issue": "판정의 세 칸을 보여주는 도식과 이후 설명의 방향이 충돌한다.",
      "why_it_matters": "원문의 핵심 은유는 ‘사람 판단에 가까운 오른쪽 칸을 결정적 검사인 왼쪽 칸으로 옮긴다’인데, 초안의 도식은 사람 판단을 왼쪽에 두고 코드 검사를 오른쪽에 둔다. 그래서 ‘오른쪽 칸에 있던 것 중 일부는 왼쪽으로 내려간다’와 ‘오른쪽에서 왼쪽으로 한 건 옮겼다’가 독자에게 반대로 읽힌다.",
      "suggestion": "세 칸 도식의 좌우를 원문 논리에 맞게 고정하고, 이후 문장의 방향 표현도 같은 기준으로 통일하라. 예: `코드 검사 <- AI 점수 신호 <- 사람 판단`처럼 이동 방향이 한눈에 보이게 만들라.",
      "severity": "high"
    },
    {
      "issue": "넷째 겹 안에 하네스, 루브릭, 정보 차단, 느린 루프, 채점표 개정 금지가 한꺼번에 들어가 관계가 압축되어 있다.",
      "why_it_matters": "하네스를 처음 접하는 독자는 ‘빠른 루프가 산출물을 판정한다’와 ‘느린 루프가 하네스 자체를 고치려 한다’의 층위 차이를 놓치기 쉽다. 특히 채점표를 고치면 전후 비교가 무효가 된다는 대목은 관계 설명이 문장으로만 이어져 있어, 왜 위험한지 즉시 보이지 않는다.",
      "suggestion": "넷째 겹을 ‘빠른 루프’와 ‘느린 루프’로 짧게 나누거나, 점수→수정→점수표 변경의 순환을 ASCII 다이어그램으로 보여줘라. 세 문장 이상으로 원인과 순서를 설명한 대목은 도식으로 바꿔 독자의 작업 기억 부담을 줄여라.",
      "severity": "medium"
    },
    {
      "issue": "채용 독자를 향한 연결이 마지막 한 문장에 몰려 있다.",
      "why_it_matters": "brief의 독자는 백엔드 개발자를 뽑는 사람이고, 원하는 것은 ‘남에게 그대로 옮길 수 있는 근거’다. 초안은 개발자 회고로는 충분히 읽히지만, 읽는 사람이 ‘그래서 이 사람을 평가할 때 무엇을 확인하면 되는가’를 중간중간 덜 받는다.",
      "suggestion": "각 전환의 끝에서 한 번씩 ‘남이 다시 확인할 수 있는 근거가 무엇으로 남았는가’를 짧게 붙여라. 새 경험을 추가하지 말고, 이미 있는 테스트 결과, 설계 규칙, 실패 기록, 미완료 목록을 채용 독자가 옮겨 적을 수 있는 증거로 명명하라.",
      "severity": "medium"
    }
  ],
  "revision_directions": [
    "세 칸 도식의 방향을 바로잡고, ‘왼쪽/오른쪽’ 표현을 한 기준으로 통일하라.",
    "넷째 겹에서 빠른 루프와 느린 루프를 구분해라. 특히 ‘점수가 낮다’와 ‘잣대가 틀렸다’의 차이를 도식이나 짧은 비유로 분리하라.",
    "채용 독자에게 남는 증거를 각 장의 끝에서 한 문장씩 회수하라. 예: ‘이 관측은 내가 무엇을 버렸는지 남긴다’처럼 판단 과정이 보이게 하라.",
    "목표 분량이 5500-7000자라면 현재 초안의 반복 문장을 줄여라. 특히 ‘이 겹에서 버린 것은’ 문형이 반복되므로 일부는 본문 판단에 흡수해도 된다."
  ],
  "reader_risks": [
    "하네스와 루브릭을 모르는 독자는 넷째 겹부터 자동화 구조를 따라가느라 핵심 메시지보다 장치 설명에 먼저 지칠 수 있다.",
    "좌우 방향이 뒤집힌 도식 때문에 ‘판정을 한 칸씩 옮긴다’는 결론을 반대로 이해할 수 있다.",
    "채용 담당 독자는 글쓴이의 사고 과정은 좋게 보면서도, 실제 선발 판단에 바로 가져갈 체크포인트가 무엇인지는 마지막까지 기다려야 할 수 있다.",
    "‘숫자는 못 한다’는 문장이 강해서, 셀 근거가 문서 안에 있을 때만 성립한다는 조건을 놓치면 과한 일반화로 읽힐 수 있다."
  ],
  "unsupported_claims": [],
  "suggestions": [
    {
      "kind": "counterpoint",
      "target": "형용사는 AI가 합리화하고, 숫자는 못 한다.",
      "proposal": "숫자도 무엇을 세야 하는지 사람이 잘못 정하면 같은 방식으로 오용될 수 있다. 숫자의 힘은 숫자 자체가 아니라 셀 대상과 제외 조건이 명시되어 있을 때 생긴다는 반대 논리를 검토할 수 있다.",
      "needs_author": false
    },
    {
      "kind": "angle",
      "target": "팀에 가져가야 하는 것도 더 빠른 구현만은 아니라고 생각한다.",
      "proposal": "이 글은 ‘AI를 잘 쓰는 개발자’보다 ‘자기 판단을 조직이 재사용 가능한 형태로 남기는 개발자’에 대한 글로도 읽을 수 있다. 채용 독자에게는 이 각도가 더 직접적으로 닿을 수 있다.",
      "needs_author": false
    },
    {
      "kind": "extension",
      "target": "AI의 흔들리는 출력에도 자리는 있다. 다만 판정석이 아니라 증인석이다.",
      "proposal": "이 논리를 한 걸음 더 밀면, AI에게 맡길 수 있는 것은 ‘정답 선언’이 아니라 ‘검증해야 할 가정의 목록화’라는 결론으로 확장된다. 마지막 결론에서 이 구분을 더 또렷하게 회수할 수 있다.",
      "needs_author": false
    },
    {
      "kind": "material",
      "target": "다음에는 사람 판단을 기록으로 모으는 것부터 한다.",
      "proposal": "brief에 재료가 있다면, 사람 판단을 어떤 단위로 모을지 필요하다. 예를 들어 산출물별 승인·기각 이유, 채점표와 어긋난 항목, 확인한 계약 파일 같은 기록 단위가 실제로 정해져 있는지 저자가 확인해야 한다.",
      "needs_author": true
    }
  ],
  "critiqued_at": "2026-08-24T10:50:50+09:00",
  "model": "gpt-5.5",
  "metadata": {
    "prompt_version": "critique_system:v1",
    "source_files": [
      "d264193d_input.json",
      "d264193d_iter-002_draft.json"
    ],
    "token_usage": {
      "input_tokens": 49158,
      "cached_input_tokens": 2432,
      "output_tokens": 2189,
      "reasoning_output_tokens": 516
    }
  }
}
